{
    "id":  "MC-vanguard-dataforge-001",
    "transaction_id":  "TXN-vanguard-dataforge-001",
    "type":  "external",
    "client":  "vanguard",
    "provider":  "dataforge",
    "scope":  "Customer data analysis for Acme strategy project",
    "price":  400,
    "currency":  "USD",
    "engagement_type":  "task",
    "deliverables":  [
                         "analysis-report.md",
                         "data-dashboard.json"
                     ],
    "deadline":  "2026-04-01",
    "status":  "completed",
    "created_at":  "2026-03-24T09:10:01.5271370Z"
}
