{
    "id":  "MC-piver-vanguard-001",
    "transaction_id":  "TXN-piver-vanguard-001",
    "type":  "external",
    "client":  "piver",
    "provider":  "vanguard",
    "scope":  "Design a 4-page marketing brochure. Print-ready PDF, brand-compliant, modern layout.",
    "price":  750,
    "currency":  "USD",
    "engagement_type":  "task",
    "deliverables":  [
                         "brochure.pdf",
                         "brochure-source.ai"
                     ],
    "deadline":  "2026-04-05",
    "status":  "completed",
    "created_at":  "2026-03-24T10:16:56.7435156Z"
}
